{
  "productGoals": [
    {
      "id": "reduce_campaign_time_to_market",
      "title": "Reduce campaign time-to-market by 70%",
      "description": "Enable users to go from campaign idea to live campaign in days instead of weeks",
      "userNeedsAddressed": ["time_consuming_ideation", "campaign_scheduling_complexity", "creative_asset_production"],
      "businessRationale": "Faster campaign creation means more opportunities to capture market demand and respond to trends",
      "priority": "critical",
      "timeframe": "short-term",
      "successMetrics": ["Average campaign creation time", "User time investment per campaign", "Campaign launch frequency"],
      "dependencies": ["AI content generation", "Platform integrations", "Template system"],
      "risks": ["Quality may suffer with speed", "User learning curve", "Technical complexity"],
      "stakeholders": ["Product team", "Engineering", "Marketing"]
    },
    {
      "id": "democratize_professional_marketing",
      "title": "Make professional marketing accessible to small businesses",
      "description": "Enable non-marketers to create campaigns that perform at professional levels",
      "userNeedsAddressed": ["lack_marketing_expertise", "effective_campaigns_without_expertise"],
      "businessRationale": "Massive underserved market of small businesses who can't afford agencies",
      "priority": "critical",
      "timeframe": "medium-term",
      "successMetrics": ["Small business user adoption", "Campaign performance vs. industry benchmarks", "User satisfaction scores"],
      "dependencies": ["Marketing best practices engine", "Educational content", "Performance benchmarking"],
      "risks": ["Oversimplification", "Competition from established players", "User expectations mismatch"],
      "stakeholders": ["Product team", "Growth team", "Customer success"]
    },
    {
      "id": "ensure_brand_consistency_at_scale",
      "title": "Maintain brand consistency across all generated content",
      "description": "AI-generated content should always align with brand voice and guidelines",
      "userNeedsAddressed": ["inconsistent_brand_voice", "maintain_brand_consistency"],
      "businessRationale": "Brand consistency builds trust and recognition, critical for customer acquisition",
      "priority": "high",
      "timeframe": "short-term",
      "successMetrics": ["Brand consistency scores", "User confidence ratings", "Content approval rates"],
      "dependencies": ["Brand voice AI training", "Style guide integration", "Content review system"],
      "risks": ["AI hallucination", "Brand drift over time", "Complex brand guidelines"],
      "stakeholders": ["Product team", "AI/ML team", "Brand team"]
    }
  ],
  "businessObjectives": [
    {
      "id": "capture_smb_marketing_market",
      "objective": "Capture 5% of the small business marketing software market within 3 years",
      "category": "market_expansion",
      "measurableOutcome": "50,000 active small business customers paying average $99/month",
      "baseline": "0 customers",
      "target": "$5M ARR from small business segment",
      "timeline": "36 months",
      "owner": "Chief Revenue Officer",
      "relatedProductGoals": ["democratize_professional_marketing", "reduce_campaign_time_to_market"]
    },
    {
      "id": "establish_ai_marketing_leadership",
      "objective": "Become the recognized leader in AI-powered marketing campaign creation",
      "category": "competitive_advantage",
      "measurableOutcome": "Top 3 search results for 'AI marketing campaigns' and industry analyst recognition",
      "baseline": "Unknown brand in AI marketing space",
      "target": "50+ industry mentions per month and thought leadership recognition",
      "timeline": "24 months",
      "owner": "Chief Marketing Officer",
      "relatedProductGoals": ["reduce_campaign_time_to_market", "ensure_brand_consistency_at_scale"]
    },
    {
      "id": "achieve_sustainable_growth",
      "objective": "Reach $10M ARR with 40% gross margins and sustainable unit economics",
      "category": "revenue",
      "measurableOutcome": "$10M annual recurring revenue with LTV:CAC ratio > 3:1",
      "baseline": "$0 ARR",
      "target": "$10M ARR, 40% gross margins, LTV:CAC > 3:1",
      "timeline": "48 months",
      "owner": "Chief Executive Officer",
      "relatedProductGoals": ["democratize_professional_marketing", "reduce_campaign_time_to_market"]
    }
  ],
  "okrs": [
    {
      "id": "q1_2024_product_foundation",
      "objective": "Build the foundational AI marketing platform",
      "quarter": "Q1 2024",
      "keyResults": [
        {
          "id": "kr_ai_content_generation",
          "result": "Launch AI content generation for 5 campaign types",
          "baseline": 0,
          "target": 5,
          "unit": "campaign types",
          "trackingMethod": "Product feature completion",
          "owner": "Product Manager"
        },
        {
          "id": "kr_user_onboarding",
          "result": "Achieve 80% completion rate for user onboarding flow",
          "baseline": 0,
          "target": 80,
          "unit": "percentage",
          "trackingMethod": "Analytics funnel tracking",
          "owner": "UX Designer"
        },
        {
          "id": "kr_brand_consistency",
          "result": "Implement brand voice consistency scoring with 85% accuracy",
          "baseline": 0,
          "target": 85,
          "unit": "percentage accuracy",
          "trackingMethod": "AI model validation testing",
          "owner": "AI/ML Engineer"
        }
      ],
      "relatedBusinessObjectives": ["establish_ai_marketing_leadership"],
      "confidence": "medium"
    },
    {
      "id": "q2_2024_market_entry",
      "objective": "Launch and acquire first 1000 users",
      "quarter": "Q2 2024",
      "keyResults": [
        {
          "id": "kr_user_acquisition",
          "result": "Acquire 1000 active users",
          "baseline": 0,
          "target": 1000,
          "unit": "active users",
          "trackingMethod": "User analytics dashboard",
          "owner": "Growth Manager"
        },
        {
          "id": "kr_campaign_creation_time",
          "result": "Reduce average campaign creation time to 2 hours",
          "baseline": 168,
          "target": 2,
          "unit": "hours",
          "trackingMethod": "User session analytics",
          "owner": "Product Manager"
        },
        {
          "id": "kr_user_satisfaction",
          "result": "Achieve NPS score of 50+",
          "baseline": 0,
          "target": 50,
          "unit": "NPS score",
          "trackingMethod": "Monthly NPS surveys",
          "owner": "Customer Success Manager"
        }
      ],
      "relatedBusinessObjectives": ["capture_smb_marketing_market"],
      "confidence": "medium"
    }
  ],
  "valueProposition": {
    "primaryValue": "Create professional marketing campaigns in minutes using AI, without marketing expertise",
    "differentiators": [
      "AI generates campaigns that match your exact brand voice",
      "No marketing experience required - guided by best practices",
      "Complete campaigns including copy, creative, and scheduling",
      "70% faster than traditional campaign creation",
      "Built specifically for small businesses and busy marketers"
    ],
    "targetSegments": ["Small business owners", "Solo entrepreneurs", "Marketing managers at growing companies", "Marketing agencies handling multiple clients"],
    "alternatives": ["Traditional marketing agencies", "Freelance marketers", "DIY with Canva + social media tools", "Marketing automation platforms"],
    "competitiveAdvantage": "Only solution that combines AI-powered content generation with marketing expertise and brand consistency at small business price points"
  },
  "monetizationStrategy": {
    "revenueModel": "subscription",
    "pricingStrategy": "value_based",
    "pricingTiers": [
      {
        "name": "Starter",
        "price": 29,
        "currency": "USD",
        "billingCycle": "monthly",
        "features": [
          "5 campaigns per month",
          "Basic AI content generation",
          "3 social media platforms",
          "Email support",
          "Brand voice setup"
        ],
        "targetUsers": ["Solo entrepreneurs", "Very small businesses"],
        "limitations": ["5 campaign limit", "Basic templates only", "No advanced scheduling"]
      },
      {
        "name": "Professional",
        "price": 99,
        "currency": "USD",
        "billingCycle": "monthly",
        "features": [
          "Unlimited campaigns",
          "Advanced AI content generation",
          "All marketing channels",
          "Priority support",
          "Advanced brand consistency",
          "Performance analytics",
          "A/B testing",
          "Team collaboration"
        ],
        "targetUsers": ["Small to medium businesses", "Marketing managers"],
        "limitations": ["Single brand only", "Standard integrations"]
      },
      {
        "name": "Agency",
        "price": 299,
        "currency": "USD",
        "billingCycle": "monthly",
        "features": [
          "Multiple brands/clients",
          "White-label options",
          "Advanced analytics",
          "Custom integrations",
          "Dedicated account manager",
          "Custom templates",
          "API access"
        ],
        "targetUsers": ["Marketing agencies", "Enterprise teams"],
        "limitations": ["Custom pricing for 50+ brands"]
      }
    ],
    "paymentModels": ["credit_card", "invoice"],
    "revenueProjections": {
      "year1": 500000,
      "year2": 2500000,
      "year3": 8000000,
      "assumptions": [
        "Average price point of $89/month",
        "95% gross revenue retention",
        "15% monthly churn in year 1, improving to 8% by year 3",
        "50% of customers upgrade tiers within 12 months"
      ]
    }
  },
  "kpis": [
    {